{
  "issue": "S1",
  "commit": "000000000000",
  "verdict": "PASS",
  "suite": "1066 passed / 6 skipped / 0 failed",
  "ac_check": [
    { "ac": "AC1", "status": "met", "note": "test_challenge_status_enum asserts the StrEnum value + the worker comparison is `is StatusEnum.SYNTHETIC_ONLY` (non-vacuous)" },
    { "ac": "AC2", "status": "met", "note": "ports.AuditSink + NoOpAuditSink present; Worker default wired; test_canary_noop_default fails if the no-op is removed" }
  ],
  "defects": [],
  "escalation": null,
  "merge_recommendation": "merge"
}
